,id,question_x,article_ids,category,subcategory,extra_description,detailed_question,question_y,answer
243,83319,quel droit est accordé au titulaire de la zone de prise d'eau,[16425],,,,quel droit est accordé au titulaire de la zone de prise d'eau,quel droit est accordé au titulaire de la zone de prise d'eau,"En Belgique, le titulaire de la zone de prise d'eau a le droit de prélever l'eau souterraine ou/et l'eau de surface pour un usage déterminé, conformément à l'autorisation délivrée par une autorité compétente (Ministère chargé de tutelle, province, etc.). Ce droit est soumis aux conditions et limites établies dans ladite autorisation, pour protéger les ressources en eau et l'environnement."
244,9043,que signifient les lois sur les lieux,[1570],,,,que signifient les lois sur les lieux,que signifient les lois sur les lieux,"Les lois sur les lieux en Belgique concernent la réglementation et la protection des droits liés à l'occupation d'un espace, tel que la propriété, la location ou l'accès public. Elles visent à garantir la sécurité, la tranquillité et le respect des droits des occupants et des visiteurs dans différents contextes (habitation, commerce, travail, etc.)."
245,81199,les mariages sont-ils requis pour une procuration,[16001],,,,les mariages sont-ils requis pour une procuration,les mariages sont-ils requis pour une procuration,"En Belgique, le mariage n'est pas un prérequis pour établir une procuration. Une procuration est un acte juridique par lequel une personne (mandant) confie à une autre (mandataire) le pouvoir de la représenter et d'accomplir des actes juridiques en son nom, sans distinction de statut marital."
246,59091,heures d'évaluation sommative,[11580],,,,heures d'évaluation sommative,heures d'évaluation sommative,"En Belgique, les heures d'évaluation sommative dépendent du niveau d'enseignement et de l'institution concernée. En général, elles se déroulent pendant les périodes d'examens officiels (janvier, juin et août) pour mesurer les compétences acquises des étudiants et déterminer leur réussite."
247,76240,quelle est la date du projet de prorogation de l'assurance,[15010],,,,quelle est la date du projet de prorogation de l'assurance,quelle est la date du projet de prorogation de l'assurance,Il est nécessaire de préciser le type d'assurance et le contexte spécifique du projet de prorogation pour fournir une réponse précise. Des informations supplémentaires sont requises pour répondre à cette question dans le contexte légal belge.
248,85382,la pollution est-elle une fraude,[16838],,,,la pollution est-elle une fraude,la pollution est-elle une fraude,"La pollution n'est pas considérée comme une fraude en Belgique, mais elle peut être punie en tant qu'infraction environnementale selon le Code de l'environnement ou d'autres lois spécifiques. La fraude implique plutôt une tromperie ou un mensonge intentionnel dans le but de réaliser un gain illégitime."
249,105209,quand la transformation transfrontalière peut-elle être effectuée,[20803],,,,quand la transformation transfrontalière peut-elle être effectuée,quand la transformation transfrontalière peut-elle être effectuée,"La transformation transfrontalière peut être effectuée lorsqu'il y a un accord entre les États membres concernés et que les exigences légales en matière de fusion ou de scission transfrontalière sont respectées, conformément aux règles établies par la Directive (UE) 2017/1132 du Parlement européen et du Conseil du 14 juin 2017."
250,88651,quelle est la bonne façon de faire un conseil participatif,[17492],,,,quelle est la bonne façon de faire un conseil participatif,quelle est la bonne façon de faire un conseil participatif,"La bonne façon de faire un conseil participatif en Belgique consiste à impliquer tous les membres concernés, assurer un dialogue ouvert et construire des décisions sur un consensus. Il est crucial de respecter les lois en vigueur, comme la législation sur la protection des données et les règles de gouvernance d'entreprise."
251,40054,comment les services évaluation accueillent,[7772],,,,comment les services évaluation accueillent,comment les services évaluation accueillent,"Il est difficile de répondre précisément sans plus de contexte concernant le type de services d'évaluation. Toutefois, généralement, les services d'évaluation en Belgique accueillent les demandes en se basant sur les normes et réglementations en vigueur, en assurant la qualité, la transparence et l'indépendance de leur travail. L'évaluation est effectuée par des experts compétents et suit le cadre légal applicable."
252,89828,à quoi sert un plan d'investissement par la taxe,[17727],,,,à quoi sert un plan d'investissement par la taxe,à quoi sert un plan d'investissement par la taxe,"Le plan d'investissement par la taxe sert à encourager les investissements en offrant des avantages fiscaux aux contribuables. Ces avantages peuvent inclure des réductions d'impôt ou des crédits d'impôt sur les revenus générés par les investissements, ainsi que des déductions pour les dépenses liées aux investissements. En Belgique, cela peut être associé à des mesures telles que le tax shelter ou les crédits d'impôt pour la recherche et développement."
253,41332,quand faire une convention de services,[8028],,,,quand faire une convention de services,quand faire une convention de services,"Faire une convention de services en Belgique lorsque deux parties souhaitent définir les termes et conditions d'une prestation de services, afin de sécuriser la relation, éviter les litiges et préciser les obligations et responsabilités de chaque partie."
254,15108,une erreur de calcul doit-elle être réparée,[2783],,,,une erreur de calcul doit-elle être réparée,une erreur de calcul doit-elle être réparée,"Oui, une erreur de calcul doit être réparée dans le contexte légal belge, car elle peut causer des préjudices ou des avantages injustifiés pour les parties concernées et ainsi compromettre l'équité et la justice dans une situation donnée."
255,73918,le prêteur peut-il obtenir les frais de fonctionnement par une rémunération fsma,[14545],,,,le prêteur peut-il obtenir les frais de fonctionnement par une rémunération fsma,le prêteur peut-il obtenir les frais de fonctionnement par une rémunération fsma,"En Belgique, le prêteur peut récupérer les frais de fonctionnement en incluant ces coûts dans la rémunération globale qu'il perçoit, à condition de respecter les règles émises par la FSMA (Autorité des services et marchés financiers). Les frais doivent être transparents, justifiés et conformes aux conditions générales du contrat de prêt."
256,69761,comment commence la demande de reouverture du tribunal,[13714],,,,comment commence la demande de reouverture du tribunal,comment commence la demande de reouverture du tribunal,"La demande de réouverture d'un procès en Belgique s'effectue en introduisant une requête en révision devant la Cour de cassation, sur la base de motifs spécifiques prévus par la loi (erreur judiciaire, nouveaux faits, faux témoignage, etc.)."
257,71764,que se passe-t-il si un accord d'emploi est admissible à une concentration,[14114],,,,que se passe-t-il si un accord d'emploi est admissible à une concentration,que se passe-t-il si un accord d'emploi est admissible à une concentration,"En Belgique, si un accord d'emploi est admissible à une concentration, cela signifie généralement qu'il est soumis à l'examen et à la validation par la Commission Européenne ou l'autorité de la concurrence belge, afin d'évaluer si l'accord respecte les règles de concurrence du marché."
258,96370,quelle est la propriété d'un navire américain qui est appartenant à l'état,[19036],,,,quelle est la propriété d'un navire américain qui est appartenant à l'état,quelle est la propriété d'un navire américain qui est appartenant à l'état,"La propriété d'un navire américain appartenant à l'État est considérée comme propriété publique des États-Unis. En droit belge, cela relève du principe d'immunité de juridiction des États souverains, donc la Belgique ne peut pas interférer dans la propriété ou l'utilisation du navire."
259,8861,Le retard de donner caution est-il une caution,[1534],,,,Le retard de donner caution est-il une caution,Le retard de donner caution est-il une caution,"Non, le retard de donner caution n'est pas une caution en soi. La caution est un engagement formel pris par une personne (le cautionneur) de garantir le paiement d'une dette ou l'exécution d'une obligation d'un tiers (le débiteur). Tant qu'une caution n'est pas donnée, il n'y a pas d'engagement juridique de garantie."
260,8082,quelle qualification est nécessaire pour désigner un administrateur de la personne,[1378],,,,quelle qualification est nécessaire pour désigner un administrateur de la personne,quelle qualification est nécessaire pour désigner un administrateur de la personne,"En Belgique, pour être désigné administrateur de la personne, il est nécessaire d'être majeur, d'avoir un casier judiciaire vierge et de disposer des compétences requises pour gérer les intérêts de la personne concernée. La désignation est réalisée par un juge de paix."
261,108994,quand le remplissage reste-t-il inerte,[21560],,,,quand le remplissage reste-t-il inerte,quand le remplissage reste-t-il inerte,"La question est trop vague pour être répondue précisément dans le contexte légal belge. Veuillez fournir plus d'informations ou clarifier le contexte dans lequel ""le remplissage"" est utilisé pour obtenir une réponse appropriée."
262,74207,qu'est-ce qui fait défaut à un avis de crédit,[14603],,,,qu'est-ce qui fait défaut à un avis de crédit,qu'est-ce qui fait défaut à un avis de crédit,"Un avis de crédit peut faire défaut en cas d'informations incomplètes, inexactes ou si les conditions légales ne sont pas respectées, comme le respect de la vie privée (RGPD) et les conditions générales de la législation sur les crédits à la consommation ou les crédits hypothécaires en Belgique."
263,44317,combien de temps les prestations handicapées seront-elles payées,[8625],,,,combien de temps les prestations handicapées seront-elles payées,combien de temps les prestations handicapées seront-elles payées,"En Belgique, les prestations pour handicapés peuvent être versées sous forme d'allocations de remplacement de revenus ou d'intégration. Ces prestations sont généralement accordées pour une période déterminée (de 1 à 5 ans) et sont révisables. Leur durée dépend de la situation médicale et des besoins spécifiques de chaque bénéficiaire."
264,97532,combien de temps faut-il aux frais de transport de l'affréteur pour la conservation de l'électronique pour la navigabilité,[19268],,,,combien de temps faut-il aux frais de transport de l'affréteur pour la conservation de l'électronique pour la navigabilité,combien de temps faut-il aux frais de transport de l'affréteur pour la conservation de l'électronique pour la navigabilité,"La question semble être mal formulée ou incomplète, il est donc difficile de fournir une réponse précise. Veuillez fournir des informations supplémentaires ou reformuler votre question pour que je puisse vous aider de manière adéquate."
265,38340,combien de temps une maison d'accueil est-elle obligatoire pour les enfants,[7430],,,,combien de temps une maison d'accueil est-elle obligatoire pour les enfants,combien de temps une maison d'accueil est-elle obligatoire pour les enfants,La durée de séjour en maison d'accueil pour les enfants varie et dépend de la décision du juge de la jeunesse qui est basée sur les circonstances individuelles et l'évaluation de l'intérêt supérieur de l'enfant. Il n'y a pas de durée fixe obligatoire en Belgique.
266,80194,le courrier fait-il un rapport d'autorisation,[15800],,,,le courrier fait-il un rapport d'autorisation,le courrier fait-il un rapport d'autorisation,"Non, le courrier ne fait pas automatiquement un rapport d'autorisation dans le contexte légal belge. Pour qu'un courrier soit valable comme preuve d'accord ou d'autorisation, il doit contenir des informations spécifiques et claires indiquant un accord explicite entre les parties concernées."
267,5578,quand le préavis annulé est-il dû,[877],,,,quand le préavis annulé est-il dû,quand le préavis annulé est-il dû,"Le préavis annulé est dû lorsqu'une partie (employeur ou employé) met fin à un contrat de travail pendant la période de préavis sans respecter le délai légal ou contractuel. Dans ce cas, la partie lésée peut réclamer une indemnité compensatoire pour le préavis non effectué."
268,74479,pourquoi un porteur ne peut-il pas refuser l'acceptation par intervention,[14657],,,,pourquoi un porteur ne peut-il pas refuser l'acceptation par intervention,pourquoi un porteur ne peut-il pas refuser l'acceptation par intervention,"En droit belge, l'acceptation par intervention est une garantie offerte au porteur d'un titre. Le porteur ne peut la refuser, car elle protège ses intérêts en permettant à un appui financier de se substituer à un engageant défaillant, ce qui sécurise le paiement."
269,97205,quel est le système de remorquage du navire,[19203],,,,quel est le système de remorquage du navire,quel est le système de remorquage du navire,"Le système de remorquage du navire en Belgique dépend du contexte. Pour les navires entrant et sortant des ports belges, des entreprises de remorquage privées fournissent des services selon des contrats et tarifs fixés. Pour le remorquage d'urgence, les garde-côtes et la Marine belge peuvent intervenir en cas de besoin."
270,113431,la confiscation des biens est-elle établie,[22448],,,,la confiscation des biens est-elle établie,la confiscation des biens est-elle établie,"En Belgique, la confiscation des biens est établie comme une sanction prévue par le Code pénal en cas de commission d'une infraction. Elle permet de priver le condamné de la propriété des biens impliqués dans l'infraction ou acquis grâce à celle-ci. Cela vise à lutter contre la criminalité et le financement illégal."
271,10902,quel est le contrat de restitution,[1942],,,,quel est le contrat de restitution,quel est le contrat de restitution,"Le contrat de restitution n'existe pas spécifiquement en droit belge. Toutefois, il peut s'agir d'une restitution après résiliation de contrat, où une partie remet à l'autre les biens ou avantages obtenus suite à l'exécution du contrat résilié."
272,28325,quel est le numéro de registre de la personne protégée,[5427],,,,quel est le numéro de registre de la personne protégée,quel est le numéro de registre de la personne protégée,"En tant qu'assistant, je ne suis pas en mesure d'accéder à des informations personnelles et confidentielles telles que le numéro de registre d'une personne protégée. Ces informations relèvent du respect de la vie privée et ne peuvent être partagées sans autorisation appropriée."
273,110647,la verrerie des canalisations est-elle identique au bac de laboratoire?,[21891],,,,la verrerie des canalisations est-elle identique au bac de laboratoire?,la verrerie des canalisations est-elle identique au bac de laboratoire?,"Non, la verrerie des canalisations concerne les conduites en verre utilisées pour le transport de fluides, tandis que le bac de laboratoire est un récipient en verre utilisé pour des expériences et manipulations chimiques. Les deux ont des utilisations et des régulations différentes au sein du milieu légal belge."
274,106418,qu'est-ce que la surveillance de santé des travailleurs,[21045],,,,qu'est-ce que la surveillance de santé des travailleurs,qu'est-ce que la surveillance de santé des travailleurs,La surveillance de santé des travailleurs en Belgique est un ensemble de mesures visant à prévenir et détecter les risques liés à la santé des salariés. Elle est instaurée par la législation belge et est obligatoire pour certains travailleurs exposés à des risques spécifiques (Service de Prévention et Protection au Travail - SePP).
275,92336,que fait un secrétaire général à un employé handicapé,[18229],,,,que fait un secrétaire général à un employé handicapé,que fait un secrétaire général à un employé handicapé,"Le secrétaire général, en tant que responsable administratif, s'assure que l'employé handicapé bénéficie des aménagements raisonnables pour son poste de travail, conformément à la législation belge sur l'emploi des personnes handicapées (Loi du 25 février 2003 et Loi du 10 mai 2007)."
276,83472,quand est-ce qu'un certificat d'agrément est incomplète,[16456],,,,quand est-ce qu'un certificat d'agrément est incomplète,quand est-ce qu'un certificat d'agrément est incomplète,"Un certificat d'agrément est incomplet lorsque certains documents obligatoires ou informations requises par la législation belge ne sont pas fournis ou ne sont pas conformes, rendant ainsi impossible la délivrance ou la reconnaissance de l'agrément en question."
277,99198,quel code du droit peut être puni pour une infraction,[19601],,,,quel code du droit peut être puni pour une infraction,quel code du droit peut être puni pour une infraction,"L'infraction est punie selon le Code pénal belge, qui définit les différentes infractions ainsi que les sanctions applicables pour chaque type d'infraction (contraventions, délits et crimes). Les justifications dépendent des faits et circonstances de chaque affaire."
278,51480,que sont les soins agréés aux personnes prostituées,[10058],,,,que sont les soins agréés aux personnes prostituées,que sont les soins agréés aux personnes prostituées,"Les soins agréés aux personnes prostituées en Belgique incluent les services de santé, psychologiques et sociaux offerts par des organisations spécialisées et agréées par les autorités, pour garantir un accompagnement adéquat et respectueux de leurs droits et besoins spécifiques. Ces soins visent à assurer leur protection et leur bien-être dans un cadre légal."
279,81261,quelles sont les conditions d'établissement des relations de vie commune,[16014],,,,quelles sont les conditions d'établissement des relations de vie commune,quelles sont les conditions d'établissement des relations de vie commune,"En Belgique, les conditions d'établissement des relations de vie commune sont : 1) être âgé de 18 ans au moins, 2) ne pas être lié par un autre partenariat ou mariage, 3) ne pas être parent proche au second degré (ex : fratrie, parent-enfant). Ces conditions assurent la légalité et la non-consanguinité des partenariats et cohabitations."
280,24110,le tribunal de réparation est-il compétent?,[4584],,,,le tribunal de réparation est-il compétent?,le tribunal de réparation est-il compétent?,"Le tribunal de réparation n'existe pas dans le système juridique belge. Pour les litiges civils, la compétence revient au tribunal de première instance, au juge de paix ou au tribunal du travail, selon la nature de l'affaire."
281,15456,quelle est la responsabilité d'un vice-ministre dans un poste de noyau,[2853],,,,quelle est la responsabilité d'un vice-ministre dans un poste de noyau,quelle est la responsabilité d'un vice-ministre dans un poste de noyau,"En Belgique, un vice-ministre n'a pas de responsabilité spécifique au sein d'un ""poste de noyau"", car cette notion n'existe pas dans le système politique belge. Un vice-ministre assure la bonne gestion de son portefeuille ministériel et collabore avec le ministre-président et ses collègues ministres au sein du gouvernement régional ou fédéral."
282,112824,quel est le règlement d'imposition de la déclaration d'affaires de la jurisprudence du travail,[22326],,,,quel est le règlement d'imposition de la déclaration d'affaires de la jurisprudence du travail,quel est le règlement d'imposition de la déclaration d'affaires de la jurisprudence du travail,"En Belgique, la déclaration d'affaires concerne principalement le démarrage d'une entreprise, qui doit s'inscrire à la Banque-Carrefour des Entreprises. Les impôts relatifs au travail dépendent du statut de l'employé et de l'employeur et sont régis par l'impôt sur les revenus et les cotisations sociales. Les justifications nécessaires sont basées sur la législation fiscale belge et le Code des impôts sur les revenus."
283,60651,combien de temps dure un accord environnemental,[11892],,,,combien de temps dure un accord environnemental,combien de temps dure un accord environnemental,"En Belgique, la durée d'un accord environnemental varie selon les dispositions spécifiques de l'accord concerné. Il peut être conclu pour une durée déterminée ou indéterminée selon les objectifs visés et les parties impliquées."
284,16984,est-ce que les chambres sont réunies,[3158],,,,est-ce que les chambres sont réunies,est-ce que les chambres sont réunies,"Dans le contexte légal Belge, les chambres sont réunies lorsqu'il s'agit d'une session conjointe de la Chambre des représentants et du Sénat, généralement pour des circonstances spécifiques telles que la prestation de serment du Roi ou la révision de la Constitution. La réponse dépend de la situation actuelle ou spécifique à laquelle vous vous référez."
285,64336,le ministère de l'immobilier transmet-il une copie à un propriétaire,[12629],,,,le ministère de l'immobilier transmet-il une copie à un propriétaire,le ministère de l'immobilier transmet-il une copie à un propriétaire,"En Belgique, le ministère de l'immobilier n'existe pas. Les questions liées à la propriété immobilière sont traitées principalement au niveau des administrations communales et du service des hypothèques. Cependant, un propriétaire peut obtenir une copie des documents liés à son bien immobilier auprès de ces institutions."
286,54845,qu'est-ce que le service de services aux usagers,[10731],,,,qu'est-ce que le service de services aux usagers,qu'est-ce que le service de services aux usagers,"Le service de services aux usagers est une entité qui fournit des services aux citoyens en matière juridique et administrative en Belgique. Il permet d'informer, d'orienter et d'assister les usagers pour faciliter leurs démarches et l'accès à la justice."
287,44097,qu'est-ce qu'un contrat pour travailler handicapé,[8581],,,,qu'est-ce qu'un contrat pour travailler handicapé,qu'est-ce qu'un contrat pour travailler handicapé,"En Belgique, un contrat pour travailleur handicapé est un contrat de travail spécifique conclu entre un employeur et une personne souffrant d'un handicap reconnu, qui tient compte de certaines mesures d'adaptation et d'aides prévues par les autorités (AWIPH en Wallonie, VAPH en Flandre, PHARE à Bruxelles). Cette disposition vise à favoriser l'inclusion des personnes handicapées sur le marché du travail."
288,8382,quel parquet peut être utilisé en permanence,[1438],,,,quel parquet peut être utilisé en permanence,quel parquet peut être utilisé en permanence,"Le parquet permanent est une expression qui n'a pas de sens dans le contexte légal belge. Si vous faites référence à un procureur compétent, il dépendra de l'affaire et de la juridiction territoriale concernée."
289,28095,quelle est la limite de l'article 1231,[5381],,,,quelle est la limite de l'article 1231,quelle est la limite de l'article 1231,"La limite de l'article 1231 du Code civil belge réside dans le fait qu'elle n'adresse que les engagements résultant de contrats ou de quasi-contrats et non d'autres sources d'obligations. Autrement dit, elle ne s'applique pas aux obligations découlant de la loi, des délits et quasi-délits ou du droit réel."
290,112564,comment faire un bordereau droit en compte,[22274],,,,comment faire un bordereau droit en compte,comment faire un bordereau droit en compte,"Pour créer un bordereau droit en compte en Belgique, vous devez lister toutes les opérations bancaires et leurs montants respectifs, en mentionnant clairement les dates et autres références nécessaires. Veillez à respecter les normes comptables et les exigences légales en termes de conservation des documents."
291,108715,l'évacuation des personnes est organisée conformément aux procédures écrites visées par lesquels la protection est délivrée,[21505],,,,l'évacuation des personnes est organisée conformément aux procédures écrites visées par lesquels la protection est délivrée,l'évacuation des personnes est organisée conformément aux procédures écrites visées par lesquels la protection est délivrée,"L'évacuation des personnes est organisée conformément aux procédures écrites prévues par la loi en matière de sécurité et de protection civile (Loi du 15 mai 2007), ainsi que par les plans d'urgence et d'intervention internes et externes établis par les autorités compétentes et les entreprises concernées (Arrêté Royal du 16 février 2006)."
292,33659,que fait une organisation de signalement,[6493],,,,que fait une organisation de signalement,que fait une organisation de signalement,"Une organisation de signalement en Belgique, comme Point de Contact (www.pointdecontact.belgique.be), reçoit, traite et transmet les signalements de contenus illégaux ou préjudiciables en ligne, afin de protéger les victimes et prévenir la propagation de ces activités sur Internet. Elle collabore généralement avec les autorités compétentes pour prendre des mesures appropriées."
