,id,question_x,article_ids,category,subcategory,extra_description,detailed_question,question_y,answer
0,91606,quand un conseiller peut-il exécuter une réclamation à l'administration,[18083],,,,quand un conseiller peut-il exécuter une réclamation à l'administration,quand un conseiller peut-il exécuter une réclamation à l'administration,"En Belgique, un conseiller peut exécuter une réclamation à l'administration lorsqu'il est confronté à une décision administrative qui affecte les droits ou les intérêts de son client, et que les voies de recours internes sont épuisées. La réclamation doit être introduite dans un délai raisonnable (généralement 60 jours) après la notification de la décision contestée."
1,21779,quels sont les deux règlements de l'acte du conseil supérieur,[4117],,,,quels sont les deux règlements de l'acte du conseil supérieur,quels sont les deux règlements de l'acte du conseil supérieur,"Les deux règlements principaux de l'Acte du Conseil Supérieur en Belgique concernent la composition et les compétences du Conseil supérieur de la Justice, qui assure la surveillance du bon fonctionnement du système judiciaire et donne des avis et recommandations sur la législation (art.151 de la Constitution belge)."
2,82126,quels organismes peuvent surveiller le fonctionnement d'une prise d'eau,[16187],,,,quels organismes peuvent surveiller le fonctionnement d'une prise d'eau,quels organismes peuvent surveiller le fonctionnement d'une prise d'eau,"En Belgique, le fonctionnement d'une prise d'eau peut être surveillé par différents organismes, principalement les services de l'Environnement des Régions (Service Public de Wallonie, Bruxelles Environnement et l'Omgevingsloket en Flandre) et les communes. Ces organismes assurent le respect des normes environnementales et de la gestion de l'eau."
3,91629,comment remplacer un conseiller par une décision du conseil d'état,[18087],,,,comment remplacer un conseiller par une décision du conseil d'état,comment remplacer un conseiller par une décision du conseil d'état,"Il n'est pas possible de remplacer un conseiller par une décision du Conseil d'État en Belgique, étant donné que le Conseil d'État est une juridiction administrative qui se prononce sur les recours contre les décisions des autorités publiques. Il appartient à l'entité concernée de procéder au remplacement de ses conseillers selon les procédures internes établies."
4,2026,quand un propriétaire du titre de droit de l'installation revient-il,[167],,,,quand un propriétaire du titre de droit de l'installation revient-il,quand un propriétaire du titre de droit de l'installation revient-il,"Le propriétaire du titre de droit de l'installation revient lorsqu'il récupère la pleine propriété, généralement après la fin d'un contrat (exemple : usufruit, emphytéose ou bail) ou lorsque les droits d'un autre titulaire (exemple : copropriétaire) sont résiliés suite à un accord ou une décision de justice. La justification dépend du type de contrat et des conditions spécifiques prévues."
5,55979,sur quels papiers le gouvernement wallon est-il tenu de déposer un rapport sur l'état de l'agriculture wallonne,[10957],,,,sur quels papiers le gouvernement wallon est-il tenu de déposer un rapport sur l'état de l'agriculture wallonne,sur quels papiers le gouvernement wallon est-il tenu de déposer un rapport sur l'état de l'agriculture wallonne,"Le Gouvernement wallon est tenu de déposer un rapport sur l'état de l'agriculture wallonne devant le Parlement wallon, généralement sous la forme d'un document officiel ou d'une présentation en séance plénière. Ce rapport peut être justifié par le respect de la transparence et de l'analyse de l'évolution du secteur agricole dans la région wallonne."
6,67679,que se passe-t-il lorsqu'un juge d'instruction fait une inculpation pour la société,[13297],,,,que se passe-t-il lorsqu'un juge d'instruction fait une inculpation pour la société,que se passe-t-il lorsqu'un juge d'instruction fait une inculpation pour la société,"Lorsqu'un juge d'instruction belge inculpe une société, celle-ci est formellement mise en cause dans une affaire pénale et doit répondre des infractions qui lui sont reprochées. La société pourra être poursuivie devant le tribunal et, en cas de condamnation, encourt des sanctions pénales telles que des amendes, voire des peines complémentaires (ex : dissolution)."
7,35985,Qu'est-ce qu'une définition de l'amende dérogée en cas de restriction du droit de rectification,[6959],,,,Qu'est-ce qu'une définition de l'amende dérogée en cas de restriction du droit de rectification,Qu'est-ce qu'une définition de l'amende dérogée en cas de restriction du droit de rectification,"L'amende dérogée en cas de restriction du droit de rectification est une mesure corrective prévue par le RGPD pour les violations des droits des personnes concernées. En Belgique, l'Autorité de protection des données (APD) peut imposer une amende administrative pour non-respect des droits des personnes, dont le droit de rectification, sauf si la rectification est légalement limitée par des exceptions prévues (par exemple, pour protéger la vie privée d'autrui ou pour des raisons de sécurité nationale)."
8,94087,quel est le but d'un médecin contrôleur,[18579],,,,quel est le but d'un médecin contrôleur,quel est le but d'un médecin contrôleur,"Le but d'un médecin contrôleur en Belgique est d'évaluer l'état de santé d'un patient pour déterminer si celui-ci est apte à accomplir ses tâches professionnelles, ou s'il est en incapacité de travail et éligible aux indemnités d'incapacité. Cette évaluation permet d'assurer le respect des règles sociales et protège les droits de l'employé et de l'employeur."
9,49652,quels sont les frais de fonctionnement du code décrétal,[9692],,,,quels sont les frais de fonctionnement du code décrétal,quels sont les frais de fonctionnement du code décrétal,"Il n'est pas possible de fournir les frais de fonctionnement du code décrétal, car le terme ""code décrétal"" ne correspond pas à une législation spécifique en Belgique. Veuillez préciser la loi ou le code en question pour une réponse appropriée."
10,60761,quels dommages sont causés par l'insurrection?,[11914],,,,quels dommages sont causés par l'insurrection?,quels dommages sont causés par l'insurrection?,"Les dommages causés par l'insurrection en Belgique peuvent inclure les atteintes aux biens publics et privés, ainsi que les préjudices physiques ou moraux pour les personnes. Ces dégâts justifient l'application de sanctions pénales prévues par les articles 101 à 104 du Code pénal belge."
11,58124,de quelle orientation avez-vous besoin pour adopter un contrat d'objectifs,[11386],,,,de quelle orientation avez-vous besoin pour adopter un contrat d'objectifs,de quelle orientation avez-vous besoin pour adopter un contrat d'objectifs,"En Belgique, pour adopter un contrat d'objectifs, il faut définir les objectifs clairs et mesurables à atteindre, et prévoir les moyens pour les accomplir. La justification repose sur l'article 6:110 du Code civil belge qui exige la licéité, la certitude, et la déterminabilité du contenu."
12,8131,quel est le but du juge de paix?,[1388],,,,quel est le but du juge de paix?,quel est le but du juge de paix?,"Le juge de paix est destiné à trancher des litiges civils de faible montant (jusqu'à 5 000 euros), et des litiges locatifs, familiaux ou de voisinage, favorisant la conciliation et la médiation entre les parties pour résoudre les conflits à l'amiable."
13,99944,qu'est-ce que le contrôle de l'armée anglaise,[19750],,,,qu'est-ce que le contrôle de l'armée anglaise,qu'est-ce que le contrôle de l'armée anglaise,Le contrôle de l'armée anglaise ne correspond pas à un concept légal spécifique en Belgique. La Belgique est un pays indépendant et ne subit pas de contrôle de l'armée anglaise (britannique) dans son système légal ou autre domaine.
14,28984,quel est le temps moyen pour déposer une réquisition,[5558],,,,quel est le temps moyen pour déposer une réquisition,quel est le temps moyen pour déposer une réquisition,"Le temps moyen pour déposer une réquisition en Belgique varie selon l'affaire et la complexité de celle-ci. Le processus s'étend généralement sur plusieurs semaines ou mois, depuis la phase d'enquête jusqu'à la rédaction et la soumission de la réquisition auprès des autorités compétentes."
15,23750,la personne peut-elle payer des prestations de sécurité sociale en belgique,[4512],,,,la personne peut-elle payer des prestations de sécurité sociale en belgique,la personne peut-elle payer des prestations de sécurité sociale en belgique,"Oui, une personne est tenue de payer des cotisations de sécurité sociale en Belgique si elle travaille en tant que salarié ou indépendant dans le pays. Les cotisations couvrent diverses prestations sociales telles que les soins de santé, les pensions, les allocations familiales et les indemnités de chômage."
16,59310,quel est le jour de l'examen pour la scolarité,[11624],,,,quel est le jour de l'examen pour la scolarité,quel est le jour de l'examen pour la scolarité,"En tant qu'assistant spécialisé dans le milieu légal Belge, je ne peux pas vous donner une réponse précise concernant les examens scolaires, car ils dépendent de chaque établissement et de chaque niveau d'éducation. Veuillez consulter le calendrier scolaire ou contacter votre établissement pour obtenir des informations sur les dates d'examen."
17,42500,que sont les services de soutien,[8262],,,,que sont les services de soutien,que sont les services de soutien,"Les services de soutien sont des organismes ou des professionnels qui offrent assistance, conseil et accompagnement aux personnes en besoin dans divers domaines juridiques, sociaux et psychologiques, tels que l'aide aux victimes, les services d'aide juridique, et le soutien aux personnes en situation de handicap. En Belgique, ces services sont régulés et financés par les autorités compétentes (fédérales, régionales ou communautaires) pour garantir l'accès à une aide adaptée pour les citoyens."
18,62522,qui est le conseil communal lors de la décision d'approbation du programme communal,[12266],,,,qui est le conseil communal lors de la décision d'approbation du programme communal,qui est le conseil communal lors de la décision d'approbation du programme communal,"Le conseil communal est l'organe délibérant composé d'élus locaux au sein d'une commune en Belgique. Il est chargé de prendre les décisions relatives aux affaires communales, dont l'approbation du programme communal qui définit les orientations et projets locaux."
19,76391,comment les droits d'obtenteur sont-ils transférés,[15040],,,,comment les droits d'obtenteur sont-ils transférés,comment les droits d'obtenteur sont-ils transférés,"Les droits d'obtenteur en Belgique peuvent être transférés par cession, héritage ou licence. La cession doit être consignée par écrit et être enregistrée auprès de l'Office de la Propriété Intellectuelle pour être opposable aux tiers."
20,60019,quand le test de reconnaissance est-il autorisé pour l'assurance-maladie,[11765],,,,quand le test de reconnaissance est-il autorisé pour l'assurance-maladie,quand le test de reconnaissance est-il autorisé pour l'assurance-maladie,"Le test de reconnaissance est autorisé pour l'assurance-maladie en Belgique lorsqu'il est prescrit par un médecin, pour des raisons médicales, et lorsque cela est reconnu comme étant nécessaire pour l'établissement ou la vérification d'un diagnostic, un traitement ou une prévention de maladies."
21,108548,qu'est-ce que les fontaines d'eau potable à usage unique,[21471],,,,qu'est-ce que les fontaines d'eau potable à usage unique,qu'est-ce que les fontaines d'eau potable à usage unique,"Les fontaines d'eau potable à usage unique sont des installations fournissant de l'eau potable aux consommateurs de manière temporaire et pour un usage limité, par exemple lors d'événements publics. La qualité de l'eau doit respecter les normes de potabilité énoncées dans la législation belge, notamment l'Arrêté royal du 14 janvier 2002 relatif à la qualité de l'eau destinée à la consommation humaine."
22,15524,définition d'auteur domicilié en belgique,[2866],,,,définition d'auteur domicilié en belgique,définition d'auteur domicilié en belgique,"Un auteur domicilié en Belgique est une personne physique ayant sa résidence principale en Belgique, où elle est inscrite au registre de la population. Cette notion est importante pour déterminer la juridiction compétente et l'application des lois belges en matière de propriété intellectuelle et droit d'auteur."
23,98600,combien de temps la radiation d'un bateau de navigation intérieure peut-elle être effectuée,[19482],,,,combien de temps la radiation d'un bateau de navigation intérieure peut-elle être effectuée,combien de temps la radiation d'un bateau de navigation intérieure peut-elle être effectuée,"La durée pour la radiation d'un bateau de navigation intérieure en Belgique n'est pas clairement spécifiée dans la législation. Cependant, il est recommandé de contacter directement les autorités compétentes telles que la Direction Générale Mobilité et Transports de la Belgique pour connaître les délais et les procédures spécifiques requises."
24,51215,ce qui est préventif et de prévention,[10005],,,,ce qui est préventif et de prévention,ce qui est préventif et de prévention,"La prévention vise à éviter ou réduire l’occurrence d’un événement ou d’un comportement indésirable, tandis que la mesure préventive est une action mise en place pour atteindre cet objectif. Ex. : prévenir la criminalité par des campagnes de sensibilisation et/ou installer des caméras de surveillance dans des zones à risque."
25,100592,comment fonctionne une société dissoute,[19880],,,,comment fonctionne une société dissoute,comment fonctionne une société dissoute,"En Belgique, une société dissoute entre en phase de liquidation où les actifs sont vendus et les dettes réglées. Une fois cette étape terminée, la dissolution peut être considérée comme clôturée et la société n'existe plus légale."
26,18304,comment un conducteur de train peut-il travailler,[3422],,,,comment un conducteur de train peut-il travailler,comment un conducteur de train peut-il travailler,"Un conducteur de train en Belgique peut travailler en obtenant un certificat de conducteur de train émis par l'Infrabel, après avoir suivi une formation spécifique et réussi un examen, conformément aux exigences du règlement européen (UE) N° 2016/796 et à la législation belge en vigueur."
27,110366,définir les obligations de répartition des risques,[21835],,,,définir les obligations de répartition des risques,définir les obligations de répartition des risques,"En Belgique, les obligations de répartition des risques désignent l'obligation légale pour les parties dans un contrat de répartir et d'assumer les risques potentiels de manière équilibrée, afin d'éviter une concentration excessive de responsabilité. Cette répartition doit être clairement stipulée dans le contrat et peut varier en fonction du type de contrat et des circonstances spécifiques."
28,34637,un autre nom pour une denrée alimentaire détruite ou dénaturée,[6689],,,,un autre nom pour une denrée alimentaire détruite ou dénaturée,un autre nom pour une denrée alimentaire détruite ou dénaturée,"En Belgique, une denrée alimentaire détruite ou dénaturée peut être qualifiée de ""non-conforme"" ou ""impropre à la consommation"", car elle ne respecte pas les normes de qualité et sécurité alimentaire imposées par l'Agence fédérale pour la sécurité de la chaîne alimentaire (AFSCA)."
29,43339,pourquoi les stagiaires sont-ils payés contre les accidents du travail,[8429],,,,pourquoi les stagiaires sont-ils payés contre les accidents du travail,pourquoi les stagiaires sont-ils payés contre les accidents du travail,"Les stagiaires en Belgique bénéficient d'une protection contre les accidents du travail car la législation impose aux employeurs de souscrire une assurance accident du travail (Loi du 10 avril 1971). Ceci garantit à tous les travailleurs, y compris les stagiaires, une couverture en cas d'accident survenant durant le stage et sur le trajet vers/depuis le lieu de stage."
30,91807,règlement du code électoral pour voter automatiquement,[18123],,,,règlement du code électoral pour voter automatiquement,règlement du code électoral pour voter automatiquement,"En Belgique, le vote automatique n'est pas autorisé. Le vote doit être effectué en personne, par procuration uniquement dans certaines conditions (absence justifiée, maladie, handicap) ou électroniquement dans quelques bureaux de vote. Le système électoral requiert une participation active et volontaire des citoyens."
31,23534,qu'est-ce qu'un conseil de barreaux,[4468],,,,qu'est-ce qu'un conseil de barreaux,qu'est-ce qu'un conseil de barreaux,Le Conseil de Barreaux en Belgique est une organisation qui représente les différents barreaux des avocats et veille au respect des règles déontologiques et à la défense des intérêts de la profession d'avocat. Il existe un conseil par ordre des avocats de chaque juridiction de première instance.
32,10328,est la déduction partielle des libéralités d'honoraires,[1827],,,,est la déduction partielle des libéralités d'honoraires,est la déduction partielle des libéralités d'honoraires,"La déduction partielle des libéralités d'honoraires en Belgique permet à un professionnel libéral, sous certaines conditions, de déduire une partie des honoraires versés à d'autres professionnels pour des prestations effectuées en commun. Cette déduction est soumise à l'accord préalable des parties et doit respecter la législation belge en matière de revenus imposables et de TVA."
33,85168,Qu'est-ce que le développement d'information comptable ordinaire,[16795],,,,Qu'est-ce que le développement d'information comptable ordinaire,Qu'est-ce que le développement d'information comptable ordinaire,"Le développement d'information comptable ordinaire fait référence à l'élaboration, l'analyse et la présentation d'informations financières conformes aux normes comptables belges (PCMN), permettant aux entreprises d'assurer la transparence et d'aider à la prise de décisions éclairées dans un contexte juridique belge."
34,11468,était une succession considérée comme un bon terme pour la séparation,[2055],,,,était une succession considérée comme un bon terme pour la séparation,était une succession considérée comme un bon terme pour la séparation,"Non, une succession n'est pas un bon terme pour la séparation. La succession concerne la transmission du patrimoine d'une personne décédée à ses héritiers, tandis que la séparation concerne la fin d'une relation entre époux ou cohabitants, généralement dans le contexte d'un divorce ou d'une séparation de fait."
35,35937,quand les données e-pv ont-elles été créées,[6949],,,,quand les données e-pv ont-elles été créées,quand les données e-pv ont-elles été créées,"Les données e-PV, système électronique de rédaction des procès-verbaux, ont été créées en Belgique en 2001 pour faciliter le travail des forces de l'ordre et la transmission d'informations aux autorités compétentes."
36,4765,que signifie le gouvernement,[715],,,,que signifie le gouvernement,que signifie le gouvernement,"Le gouvernement en Belgique signifie l'ensemble des ministres et secrétaires d'État chargés de l'exécution des lois et des politiques publiques. Il est composé de membres issus des différents partis politiques représentés au Parlement, sous la direction du Premier ministre, et tient sa légitimité du roi."
37,100868,définition de l'article 5 sur la presse,[19935],,,,définition de l'article 5 sur la presse,définition de l'article 5 sur la presse,"L'article 5 de la Constitution belge garantit la liberté d'imprimer ses opinions sans censure préalable, tout en assujettissant les auteurs, imprimeurs et éditeurs à la responsabilité des abus de cette liberté dans les limites déterminées par la loi."
38,82714,quelle est l'unité d'eau de surface et le point de captage d'eau,[16304],,,,quelle est l'unité d'eau de surface et le point de captage d'eau,quelle est l'unité d'eau de surface et le point de captage d'eau,"En Belgique, l'unité d'eau de surface correspond à un cours d'eau, un lac ou un canal, tandis que le point de captage d'eau est le lieu où l'eau souterraine ou l'eau de surface est extraite pour l'approvisionnement en eau potable ou industrielle (Règlementaires liés à la Directive-cadre sur l'eau 2000/60/CE et législations régionales sur l'eau)."
39,7154,est un nom choisi par l'adoptant ou les adoptants?,[1192],,,,est un nom choisi par l'adoptant ou les adoptants?,est un nom choisi par l'adoptant ou les adoptants?,"En Belgique, le nom de famille de l'adopté est généralement celui de l'adoptant (ou des adoptants en cas d'adoption conjointe). La loi permet de conserver, ajouter ou modifier le(s) nom(s) conformément à l'article 335 du Code civil belge."
40,15109,comment le calcul des problèmes de transaction a-t-il été réparé,[2783],,,,comment le calcul des problèmes de transaction a-t-il été réparé,comment le calcul des problèmes de transaction a-t-il été réparé,"Le calcul des problèmes de transaction en Belgique a été réparé en adoptant et en respectant les régulations mises en place par les autorités compétentes, comme la FSMA, et en utilisant des contrats clairs, transparents et conformes au droit belge pour éviter les litiges."
41,40194,définir l'association non lucrative,[7800],,,,définir l'association non lucrative,définir l'association non lucrative,"L'association non lucrative (ASBL) en Belgique est une entité juridique composée d'au moins deux membres, dont l'objectif principal est de réaliser un but désintéressé, sans distribuer de bénéfices aux fondateurs ou membres. Elle est régie par la loi du 27 juin 1921, modifiée par la loi du 2 mai 2002."
42,59825,pourquoi la publicité est-elle importante,[11727],,,,pourquoi la publicité est-elle importante,pourquoi la publicité est-elle importante,"La publicité est importante en Belgique car elle soutient l'économie en stimulant la concurrence et la croissance, favorise la diffusion d'informations sur les produits et services, et permet aux consommateurs de faire des choix éclairés. Cependant, elle est encadrée par des régulations strictes pour protéger les consommateurs et assurer la concurrence loyale."
43,101506,quand les investissements fiscals du patrimoine de la société sont-ils disponibles,[20063],,,,quand les investissements fiscals du patrimoine de la société sont-ils disponibles,quand les investissements fiscals du patrimoine de la société sont-ils disponibles,"Les investissements fiscaux du patrimoine de la société sont disponibles lorsque ceux-ci respectent les conditions de dégrèvement/avantages fiscaux énoncés par la législation belge, notamment être réalisé dans des actifs admissibles et respecter la période de détention minimale."
44,92032,comment un candidat peut-il demander des candidatures à une mutation,[18168],,,,comment un candidat peut-il demander des candidatures à une mutation,comment un candidat peut-il demander des candidatures à une mutation,"En Belgique, un candidat souhaitant postuler pour une mutation doit envoyer une demande écrite à son employeur actuel, en mentionnant le poste souhaité, la date de prise de fonction et les motivations. La demande doit être conforme aux procédures internes de l'entreprise et respecter les délais et conditions définis dans la législation du travail et la convention collective applicable."
45,89590,quel jour est considéré comme un jour férié,[17680],,,,quel jour est considéré comme un jour férié,quel jour est considéré comme un jour férié,"Le 1er mai est considéré comme un jour férié légal en Belgique, célébrant la Fête du Travail. En Belgique, il existe 10 jours fériés légaux au total, dont Noël, la Journée nationale, et l'Assomption."
46,32845,est une amende en quatrième chapitre pour l'heure?,[6331],,,,est une amende en quatrième chapitre pour l'heure?,est une amende en quatrième chapitre pour l'heure?,"Il est difficile de répondre précisément sans plus de contexte, mais en général, une amende en ""quatrième chapitre"" fait probablement référence à une amende de niveau 4, qui est une sanction pécuniaire en droit pénal belge. Le montant de l'amende dépend du délit et des circonstances. Le contexte de l'heure n'est pas clair. Si cela concerne une infraction horaire (par exemple, une restriction de stationnement), une amende peut être imposée pour la violation de cette restriction, généralement de niveau 1 (article 29 de la loi du 4 août 1996 relative à la police de la circulation routière)."
47,85844,sécurité des moyens de surveillance d'un organisme d'assainissement agréé,[16930],,,,sécurité des moyens de surveillance d'un organisme d'assainissement agréé,sécurité des moyens de surveillance d'un organisme d'assainissement agréé,La sécurité des moyens de surveillance d'un organisme d'assainissement agréé en Belgique doit respecter les réglementations de protection des données (RGPD) et les exigences de l'Agence fédérale pour la sécurité de la chaîne alimentaire (AFSCA) pour protéger la vie privée et la sécurité des installations.
